{
  "schema_version": 1,
  "next_ai_due_at": null,
  "batches": {
    "45ff8462f532515182607ea40866490491c6ef1d01cc85bcebd8d071ec646fe4": {
      "id": "45ff8462f532515182607ea40866490491c6ef1d01cc85bcebd8d071ec646fe4",
      "input_hash": "45ff8462f532515182607ea40866490491c6ef1d01cc85bcebd8d071ec646fe4",
      "event_ids": [
        "004ad8bcfd0cef7f29cdacc6dbdbd1f7da4e224ff6a3f53eae6b853758f73b68",
        "00cfe146bd66aa766f1273c9c77dc0d6222e0b27309e37a8148b235d03f2f2d5",
        "01d8eb3e7e3654286905e44da9c9ec6c8000d241c55dea49e982c0d15c370581",
        "021d4d83fbf0239bb940e8d8974efcfd0de99e9a81abf0d962fcc2474c50c041",
        "0456c81e40a0ba912a9dddf15b498fe9a859b33f06d9807a5522fc94ed2b7b0c",
        "06c406854cfe2cd2a4558b87aaa240db60e55a4fa30824e6525025e2194ead25",
        "070796c14c62bbd48025facc464e0b72b11e06e726d8523b8988e6d8252466a4",
        "0c11db27469ec0806d0b8dd57c070b6855d02d6710b640e6bd13bcbd785bd161",
        "0c17128ced592b5b5b50592bdb4bdc62df032918159c7880d48712c764fe3f43",
        "0fabec639d9c79b509e1543a4f3a4558910a822c301f4d5631f4d328107da42d",
        "1011229f1793b7347f8b058306dab6706d5e1d829e2ba1a260bfdf89e7b5616f",
        "1322ad99059db79e7ed3461addb9a947163896941c021369136141df0b0b25d2",
        "1345e67a46964c0b7be270c74ef8af945ea19429674bf9696d92f32b0cca14a9",
        "144dda7929275efc0a5bbe9ab40c98eb77a358556e94a14c3ee22ff2e2d0f22f",
        "1813e9fee70a627b64f83d03cdd7bcf3346351cd26ef5736f90be4889625bb31",
        "1922d22c531f1ad6100f23cab70fd881601aa0beae0dab3d5388ab52d4fbc14e",
        "1f588fbb1381eddfe67ead83d6fd5c0e5f2b7f765e34d789d069d0e0e6e9b14d",
        "243c47080e2355da38f1e74f21b2e215e99a59c48dd32cff4fe343b705f0105f",
        "2b2f67e1bdda989cc80a9b93c723fa88d3114f3ed1775b95b0f70e92b6f9499f",
        "2bee4410907d98c3ab6854f60464af4fd46e9f581ebaee1256078db5fb5249db",
        "2eeca9f0784759000420978c8cc045dffcf5767de74799a4c3236fe81b60911c",
        "412556a0aa7ca1ac39fe9e770f6064ebbb8ea32573971bd8af8af04bc5178faf",
        "45df81a41bb0c6a48b9cb65008d977b74fa5673a67eddcbe69ba956949e3b2a9",
        "4b1aa7778da01244645d22f96dbf7721910f58f1e1baa36c6dff94c0571412e6",
        "500f0ed956c9c09ef089dafeb06c26fabd5055b67e5faa34abd6fd0ee42de421",
        "587aa1242fcb75ae137061230949d03b3034a617288191389fd95f5f6629aa3b",
        "658af337cab545c6db2490191bf8ad6d8a040208a690379cf1a25781a1e9342d",
        "7579e5c50d5f998956bddb2926117b9cc105f88c078c351e08588dfa607ed17e",
        "8d018148a9efad0ca0c1f2d8a89f04177ccfd13bec05af548dcb646cd40720f6",
        "c06b8a300e70abc59e8882584bcb5696d233a316c9a8dd8d8fed8f00b4da02cd",
        "c6850da96f3957d416429c02e4b2ba213fc260d1d0ffd0fbcead0eb614f9082d",
        "d77d841874d577252ea6f04fb1c85db43d4ddc6267027055c050c0e2becdbc2d"
      ],
      "status": "ambiguous",
      "reserved_usd": "0.3217728",
      "actual_usd": null,
      "result_hash": null,
      "review_pr_url": null,
      "reservation_month": "2026-10",
      "charged_month": null,
      "result": null,
      "request": {
        "batch_id": "45ff8462f532515182607ea40866490491c6ef1d01cc85bcebd8d071ec646fe4",
        "model": "deepseek-flash",
        "prompt_version": "enrichment-v1",
        "schema_version": "enrichment-result-v1",
        "event_inputs": [
          {
            "event_id": "01d8eb3e7e3654286905e44da9c9ec6c8000d241c55dea49e982c0d15c370581",
            "source_id": "f85a215baee3e24d438d51f5936cc98f3d4968591964d2e153cf400c750ed04d",
            "feed_source_id": "github-spec-kit",
            "content_hash": "509f0d66267d3879eca175f9d67b11debe37377f089878a8bccc2b84da285e7d",
            "title": "Spec Kit - 1.0.4",
            "excerpt": "## Install ```bash uv tool install specify-cli --from git+https://github.com/github/spec-kit.git@v1.0.4 specify init my-project ``` ## What's Changed - chore: bump version to 1.0.4 - fix(scripts): stop wrap composition looping on a token in core content (#4396) - [extension] Update Charter extension to v0.6.1 (#4409) - fix(workflows): keep non-ASCII text readable in written overlay files (#4148) - fix(workflows): report overlay operation keys in declaration order (#4146) - fix: skip corrupted state.json in list_runs() instead of aborting (#3904) - fix(rovodev): guard non-string prompt names wh",
            "url": "https://github.com/github/spec-kit/releases/tag/v1.0.4",
            "kind": "text"
          },
          {
            "event_id": "00cfe146bd66aa766f1273c9c77dc0d6222e0b27309e37a8148b235d03f2f2d5",
            "source_id": "524cbf3dd2c5886cb1a8df1ee0366150fd4f7db61cc95b5c517065d4c8b15686",
            "feed_source_id": "spring-projects-spring-ai",
            "content_hash": "cf1ccd3ef73a4c91ff8435676cdd0a1b8910f27b918e027e0f3215c79bb111b4",
            "title": "Spring AI 2.0.0-RC1",
            "excerpt": "## :star: New Features - Add turn-boundary snapping to MessageWindowChatMemory eviction [#6312](https://github.com/spring-projects/spring-ai/pull/6312) - Finish to remove default values from models [#6311](https://github.com/spring-projects/spring-ai/pull/6311) - Move advisors to their proper modules [#6309](https://github.com/spring-projects/spring-ai/pull/6309) - Remove SpringBeanToolCallbackResolver and toolNames() API [#6301](https://github.com/spring-projects/spring-ai/pull/6301) - Streamline OpenAiChatModel implementations [#6295](https://github.com/spring-projects/spring-ai/pull/6295) -",
            "url": "https://github.com/spring-projects/spring-ai/releases/tag/v2.0.0-RC1",
            "kind": "text"
          },
          {
            "event_id": "1813e9fee70a627b64f83d03cdd7bcf3346351cd26ef5736f90be4889625bb31",
            "source_id": "a9ea1702358ef319b3a6876e27304521c74aab65f50b144d68fac7f7daa889c6",
            "feed_source_id": "anthropics-claude-code",
            "content_hash": "700e173f77e13a9d46655dc0e18a7ca513c72e1a98f026f3d4e5ec0ead478a88",
            "title": "v2.1.291",
            "excerpt": "## What's changed - Fixed a regression in 2.1.290 where cloud sessions could drop answers to permission prompts - Fixed a regression in 2.1.288 where the last messages of a session could be lost when quitting",
            "url": "https://github.com/anthropics/claude-code/releases/tag/v2.1.291",
            "kind": "text"
          },
          {
            "event_id": "021d4d83fbf0239bb940e8d8974efcfd0de99e9a81abf0d962fcc2474c50c041",
            "source_id": "8f20aad283aea493d29028922c17c8085266d8d36e213aa76f65dc0a6e28a1c3",
            "feed_source_id": "temporalio-sdk-python",
            "content_hash": "136fbb5ca31b7bc5397ea1dda3374a05958060d8f1e7b4a14863cb0d63c9e0a4",
            "title": "1.21.1",
            "excerpt": "[PyPI](https://pypi.org/project/temporalio/) ## Bug Fixes * Dynamic handlers now support `typing.Sequence` and `collections.abc.Sequence` for their third argument. * Add compatibility with OpenAI Agents SDK 0.6.4. ## Specific Changes 2025-12-19 - 772050e - Add backward compatibility for dynamic handler signatures (#1258) 2025-12-19 - f0bd341 - OpenAI - Fix generics is instance (#1261)",
            "url": "https://github.com/temporalio/sdk-python/releases/tag/1.21.1",
            "kind": "text"
          },
          {
            "event_id": "1f588fbb1381eddfe67ead83d6fd5c0e5f2b7f765e34d789d069d0e0e6e9b14d",
            "source_id": "c650567c5a57adca2ccfb3c96927b381ca47fe349ff73d3a99420fde3fd36b73",
            "feed_source_id": "anthropics-claude-code",
            "content_hash": "7e8f16d0405bc09db62a82d4677cd48d7798c5788db6356793abf7cb85f50f05",
            "title": "v2.1.292",
            "excerpt": "## What's changed - Added `--marketplace ` to `claude plugin install`: adds the marketplace if needed, under the same policy checks as `claude plugin marketplace add`, then installs the plugin from it - Added an `effort` parameter to the Agent tool, so Claude runs a sub-agent at the effort level you ask for - Added `CLAUDE_CODE_OVERLOADED_RETRY_BASE_DELAY_MS` environment variable to set a longer base delay for the backoff when retrying an overloaded (529) request - Added `prompt.autocomplete`, an event a mod hooks to add its own rows to the prompt box's autocomplete list - Added prompt caching",
            "url": "https://github.com/anthropics/claude-code/releases/tag/v2.1.292",
            "kind": "text"
          },
          {
            "event_id": "06c406854cfe2cd2a4558b87aaa240db60e55a4fa30824e6525025e2194ead25",
            "source_id": "4bc22f66e19ae18a7567bc549f2550d0ab33b35f2f8a63dfc6d1362394a60c7d",
            "feed_source_id": "pydantic-pydantic-ai",
            "content_hash": "f9dcb5c70cf625282b1df81ecf58200751f4752323247381c24ad81f4611ae54",
            "title": "v2.51.0 (2026-09-25)",
            "excerpt": "## What's Changed ### ⚠️ Compatibility Notes * Match dated `gemini-3.8-live` ids, reject `google_affective_dialog` on Gemini 3.1 Flash Live and 3.8 Live at connect, and raise `RealtimeError` for Gemini Live close codes by @DouweM in https://github.com/pydantic/pydantic-ai/pull/8761 * Raise a `UserError` for a realtime `tool_choice` that forces a tool call on OpenAI, Azure OpenAI, and xAI by @DouweM in https://github.com/pydantic/pydantic-ai/pull/8755 ### 🚀 Features * Add OpenAI GPT-Live support with `OpenAILiveModel` by @DouweM in https://github.com/pydantic/pydantic-ai/pull/8390 * Expose `con",
            "url": "https://github.com/pydantic/pydantic-ai/releases/tag/v2.51.0",
            "kind": "text"
          },
          {
            "event_id": "2b2f67e1bdda989cc80a9b93c723fa88d3114f3ed1775b95b0f70e92b6f9499f",
            "source_id": "2102b33c08f6fc51fbe161795a56da9094bdc16c6cd31c5ac0d7907e07e3a953",
            "feed_source_id": "anthropics-claude-code",
            "content_hash": "48155021638b8546a9f4be8b6f22ee89c24f923f6b8af7e7b01d608df0cd1a6f",
            "title": "v2.1.294",